
*** Running vivado
    with args -log top.vdi -applog -m64 -product Vivado -messageDb vivado.pb -mode batch -source top.tcl -notrace



****** Vivado v2024.2 (64-bit)
  **** SW Build 5239630 on Fri Nov 08 22:35:27 MST 2024
  **** IP Build 5239520 on Sun Nov 10 16:12:51 MST 2024
  **** SharedData Build 5239561 on Fri Nov 08 14:39:27 MST 2024
  **** Start of session at: Sat Dec  6 19:19:03 2025
    ** Copyright 1986-2022 Xilinx, Inc. All Rights Reserved.
    ** Copyright 2022-2024 Advanced Micro Devices, Inc. All Rights Reserved.

Sourcing tcl script 'C:/Users/Allen/AppData/Roaming/Xilinx/Vivado/Vivado_init.tcl'
source top.tcl -notrace
Command: link_design -top top -part xc7a100tcsg324-1
Design is defaulting to srcset: sources_1
Design is defaulting to constrset: constrs_1
INFO: [Device 21-403] Loading part xc7a100tcsg324-1
Netlist sorting complete. Time (s): cpu = 00:00:00 ; elapsed = 00:00:00.003 . Memory (MB): peak = 562.398 ; gain = 0.000
INFO: [Netlist 29-17] Analyzing 22 Unisim elements for replacement
INFO: [Netlist 29-28] Unisim Transformation completed in 0 CPU seconds
INFO: [Project 1-479] Netlist was created with Vivado 2024.2
INFO: [Project 1-570] Preparing netlist for logic optimization
Parsing XDC File [C:/Users/Allen/Vivado Projects/FPGA-Blackjack/FPGA_Blackjack.srcs/constrs_1/new/NexysA7.xdc]
Finished Parsing XDC File [C:/Users/Allen/Vivado Projects/FPGA-Blackjack/FPGA_Blackjack.srcs/constrs_1/new/NexysA7.xdc]
INFO: [Opt 31-138] Pushed 0 inverter(s) to 0 load pin(s).
Netlist sorting complete. Time (s): cpu = 00:00:00 ; elapsed = 00:00:00 . Memory (MB): peak = 695.098 ; gain = 0.000
INFO: [Project 1-111] Unisim Transformation Summary:
No Unisim elements were transformed.

7 Infos, 0 Warnings, 0 Critical Warnings and 0 Errors encountered.
link_design completed successfully
Command: opt_design
Attempting to get a license for feature 'Implementation' and/or device 'xc7a100t'
INFO: [Common 17-349] Got license for feature 'Implementation' and/or device 'xc7a100t'
Running DRC as a precondition to command opt_design

Starting DRC Task
INFO: [DRC 23-27] Running DRC with 2 threads
INFO: [Project 1-461] DRC finished with 0 Errors
INFO: [Project 1-462] Please refer to the DRC report (report_drc) for more information.

Time (s): cpu = 00:00:00 ; elapsed = 00:00:01 . Memory (MB): peak = 729.523 ; gain = 30.367

Starting Cache Timing Information Task
INFO: [Timing 38-35] Done setting XDC timing constraints.
Ending Cache Timing Information Task | Checksum: 19f82aaac

Time (s): cpu = 00:00:01 ; elapsed = 00:00:05 . Memory (MB): peak = 1288.699 ; gain = 559.176

Starting Logic Optimization Task

Phase 1 Initialization

Phase 1.1 Core Generation And Design Setup
Phase 1.1 Core Generation And Design Setup | Checksum: 19f82aaac

Time (s): cpu = 00:00:00 ; elapsed = 00:00:00.001 . Memory (MB): peak = 1693.668 ; gain = 0.000

Phase 1.2 Setup Constraints And Sort Netlist
Phase 1.2 Setup Constraints And Sort Netlist | Checksum: 19f82aaac

Time (s): cpu = 00:00:00 ; elapsed = 00:00:00.002 . Memory (MB): peak = 1693.668 ; gain = 0.000
Phase 1 Initialization | Checksum: 19f82aaac

Time (s): cpu = 00:00:00 ; elapsed = 00:00:00.002 . Memory (MB): peak = 1693.668 ; gain = 0.000

Phase 2 Timer Update And Timing Data Collection

Phase 2.1 Timer Update
Phase 2.1 Timer Update | Checksum: 19f82aaac

Time (s): cpu = 00:00:00 ; elapsed = 00:00:00.010 . Memory (MB): peak = 1693.668 ; gain = 0.000

Phase 2.2 Timing Data Collection
Phase 2.2 Timing Data Collection | Checksum: 19f82aaac

Time (s): cpu = 00:00:00 ; elapsed = 00:00:00.013 . Memory (MB): peak = 1693.668 ; gain = 0.000
Phase 2 Timer Update And Timing Data Collection | Checksum: 19f82aaac

Time (s): cpu = 00:00:00 ; elapsed = 00:00:00.013 . Memory (MB): peak = 1693.668 ; gain = 0.000

Phase 3 Retarget
INFO: [Opt 31-1851] Number of loadless carry chains removed were: 0
INFO: [Opt 31-1834] Total Chains To Be Transformed Were: 0 AND Number of Transformed insts Created are: 0
INFO: [Opt 31-138] Pushed 0 inverter(s) to 0 load pin(s).
INFO: [Opt 31-49] Retargeted 0 cell(s).
Phase 3 Retarget | Checksum: 19f82aaac

Time (s): cpu = 00:00:00 ; elapsed = 00:00:00.019 . Memory (MB): peak = 1693.668 ; gain = 0.000
Retarget | Checksum: 19f82aaac
INFO: [Opt 31-389] Phase Retarget created 0 cells and removed 0 cells

Phase 4 Constant propagation
INFO: [Opt 31-138] Pushed 0 inverter(s) to 0 load pin(s).
Phase 4 Constant propagation | Checksum: 19f82aaac

Time (s): cpu = 00:00:00 ; elapsed = 00:00:00.021 . Memory (MB): peak = 1693.668 ; gain = 0.000
Constant propagation | Checksum: 19f82aaac
INFO: [Opt 31-389] Phase Constant propagation created 0 cells and removed 0 cells

Phase 5 Sweep
INFO: [Constraints 18-11670] Building netlist checker database with flags, 0x8
Done building netlist checker database: Time (s): cpu = 00:00:00 ; elapsed = 00:00:00 . Memory (MB): peak = 1693.668 ; gain = 0.000
Phase 5 Sweep | Checksum: 208c333b2

Time (s): cpu = 00:00:00 ; elapsed = 00:00:00.025 . Memory (MB): peak = 1693.668 ; gain = 0.000
Sweep | Checksum: 208c333b2
INFO: [Opt 31-389] Phase Sweep created 0 cells and removed 0 cells

Phase 6 BUFG optimization
Phase 6 BUFG optimization | Checksum: 208c333b2

Time (s): cpu = 00:00:00 ; elapsed = 00:00:00.045 . Memory (MB): peak = 1693.668 ; gain = 0.000
BUFG optimization | Checksum: 208c333b2
INFO: [Opt 31-662] Phase BUFG optimization created 0 cells of which 0 are BUFGs and removed 0 cells.

Phase 7 Shift Register Optimization
INFO: [Opt 31-1064] SRL Remap converted 0 SRLs to 0 registers and converted 0 registers of register chains to 0 SRLs
Phase 7 Shift Register Optimization | Checksum: 208c333b2

Time (s): cpu = 00:00:00 ; elapsed = 00:00:00.046 . Memory (MB): peak = 1693.668 ; gain = 0.000
Shift Register Optimization | Checksum: 208c333b2
INFO: [Opt 31-389] Phase Shift Register Optimization created 0 cells and removed 0 cells

Phase 8 Post Processing Netlist
Phase 8 Post Processing Netlist | Checksum: 208c333b2

Time (s): cpu = 00:00:00 ; elapsed = 00:00:00.047 . Memory (MB): peak = 1693.668 ; gain = 0.000
Post Processing Netlist | Checksum: 208c333b2
INFO: [Opt 31-389] Phase Post Processing Netlist created 0 cells and removed 0 cells

Phase 9 Finalization

Phase 9.1 Finalizing Design Cores and Updating Shapes
Phase 9.1 Finalizing Design Cores and Updating Shapes | Checksum: 2f3495c5d

Time (s): cpu = 00:00:00 ; elapsed = 00:00:00.054 . Memory (MB): peak = 1693.668 ; gain = 0.000

Phase 9.2 Verifying Netlist Connectivity

Starting Connectivity Check Task

Time (s): cpu = 00:00:00 ; elapsed = 00:00:00.003 . Memory (MB): peak = 1693.668 ; gain = 0.000
Phase 9.2 Verifying Netlist Connectivity | Checksum: 2f3495c5d

Time (s): cpu = 00:00:00 ; elapsed = 00:00:00.058 . Memory (MB): peak = 1693.668 ; gain = 0.000
Phase 9 Finalization | Checksum: 2f3495c5d

Time (s): cpu = 00:00:00 ; elapsed = 00:00:00.058 . Memory (MB): peak = 1693.668 ; gain = 0.000
Opt_design Change Summary
=========================


-------------------------------------------------------------------------------------------------------------------------
|  Phase                        |  #Cells created  |  #Cells Removed  |  #Constrained objects preventing optimizations  |
-------------------------------------------------------------------------------------------------------------------------
|  Retarget                     |               0  |               0  |                                              0  |
|  Constant propagation         |               0  |               0  |                                              0  |
|  Sweep                        |               0  |               0  |                                              0  |
|  BUFG optimization            |               0  |               0  |                                              0  |
|  Shift Register Optimization  |               0  |               0  |                                              0  |
|  Post Processing Netlist      |               0  |               0  |                                              0  |
-------------------------------------------------------------------------------------------------------------------------


Ending Logic Optimization Task | Checksum: 2f3495c5d

Time (s): cpu = 00:00:00 ; elapsed = 00:00:00.059 . Memory (MB): peak = 1693.668 ; gain = 0.000

Starting Power Optimization Task
INFO: [Pwropt 34-132] Skipping clock gating for clocks with a period < 2.00 ns.
Ending Power Optimization Task | Checksum: 2f3495c5d

Time (s): cpu = 00:00:00 ; elapsed = 00:00:00.005 . Memory (MB): peak = 1693.668 ; gain = 0.000

Starting Final Cleanup Task
Ending Final Cleanup Task | Checksum: 2f3495c5d

Time (s): cpu = 00:00:00 ; elapsed = 00:00:00 . Memory (MB): peak = 1693.668 ; gain = 0.000

Starting Netlist Obfuscation Task
Netlist sorting complete. Time (s): cpu = 00:00:00 ; elapsed = 00:00:00 . Memory (MB): peak = 1693.668 ; gain = 0.000
Ending Netlist Obfuscation Task | Checksum: 2f3495c5d

Time (s): cpu = 00:00:00 ; elapsed = 00:00:00.001 . Memory (MB): peak = 1693.668 ; gain = 0.000
INFO: [Common 17-83] Releasing license: Implementation
27 Infos, 0 Warnings, 0 Critical Warnings and 0 Errors encountered.
opt_design completed successfully
opt_design: Time (s): cpu = 00:00:02 ; elapsed = 00:00:08 . Memory (MB): peak = 1693.668 ; gain = 994.512
INFO: [Vivado 12-24828] Executing command : report_drc -file top_drc_opted.rpt -pb top_drc_opted.pb -rpx top_drc_opted.rpx
Command: report_drc -file top_drc_opted.rpt -pb top_drc_opted.pb -rpx top_drc_opted.rpx
INFO: [IP_Flow 19-234] Refreshing IP repositories
INFO: [IP_Flow 19-1704] No user IP repositories specified
INFO: [IP_Flow 19-2313] Loaded Vivado IP repository 'C:/Xilinx/Vivado/2024.2/data/ip'.
INFO: [DRC 23-27] Running DRC with 2 threads
INFO: [Vivado_Tcl 2-168] The results of DRC are in file C:/Users/Allen/Vivado Projects/FPGA-Blackjack/FPGA_Blackjack.runs/impl_1/top_drc_opted.rpt.
report_drc completed successfully
INFO: [Timing 38-480] Writing timing data to binary archive.
Write ShapeDB Complete: Time (s): cpu = 00:00:00 ; elapsed = 00:00:00.002 . Memory (MB): peak = 1693.668 ; gain = 0.000
Wrote PlaceDB: Time (s): cpu = 00:00:00 ; elapsed = 00:00:00.003 . Memory (MB): peak = 1693.668 ; gain = 0.000
Wrote PulsedLatchDB: Time (s): cpu = 00:00:00 ; elapsed = 00:00:00 . Memory (MB): peak = 1693.668 ; gain = 0.000
Writing XDEF routing.
Writing XDEF routing logical nets.
Writing XDEF routing special nets.
Wrote RouteStorage: Time (s): cpu = 00:00:00 ; elapsed = 00:00:00.017 . Memory (MB): peak = 1693.668 ; gain = 0.000
Wrote Netlist Cache: Time (s): cpu = 00:00:00 ; elapsed = 00:00:00.001 . Memory (MB): peak = 1693.668 ; gain = 0.000
Wrote Device Cache: Time (s): cpu = 00:00:00 ; elapsed = 00:00:00.006 . Memory (MB): peak = 1693.668 ; gain = 0.000
Write Physdb Complete: Time (s): cpu = 00:00:00 ; elapsed = 00:00:00.033 . Memory (MB): peak = 1693.668 ; gain = 0.000
INFO: [Common 17-1381] The checkpoint 'C:/Users/Allen/Vivado Projects/FPGA-Blackjack/FPGA_Blackjack.runs/impl_1/top_opt.dcp' has been generated.
Command: place_design
Attempting to get a license for feature 'Implementation' and/or device 'xc7a100t'
INFO: [Common 17-349] Got license for feature 'Implementation' and/or device 'xc7a100t'
INFO: [Common 17-83] Releasing license: Implementation
INFO: [DRC 23-27] Running DRC with 2 threads
INFO: [Vivado_Tcl 4-198] DRC finished with 0 Errors
INFO: [Vivado_Tcl 4-199] Please refer to the DRC report (report_drc) for more information.
Running DRC as a precondition to command place_design
INFO: [DRC 23-27] Running DRC with 2 threads
INFO: [Vivado_Tcl 4-198] DRC finished with 0 Errors
INFO: [Vivado_Tcl 4-199] Please refer to the DRC report (report_drc) for more information.
INFO: [Place 30-611] Multithreading enabled for place_design using a maximum of 2 CPUs

Starting Placer Task

Phase 1 Placer Initialization

Phase 1.1 Placer Initialization Netlist Sorting
Netlist sorting complete. Time (s): cpu = 00:00:00 ; elapsed = 00:00:00 . Memory (MB): peak = 1693.668 ; gain = 0.000
Phase 1.1 Placer Initialization Netlist Sorting | Checksum: 22e872c6a

Time (s): cpu = 00:00:00 ; elapsed = 00:00:00.001 . Memory (MB): peak = 1693.668 ; gain = 0.000
Netlist sorting complete. Time (s): cpu = 00:00:00 ; elapsed = 00:00:00 . Memory (MB): peak = 1693.668 ; gain = 0.000

Phase 1.2 IO Placement/ Clock Placement/ Build Placer Device
INFO: [Timing 38-35] Done setting XDC timing constraints.
Phase 1.2 IO Placement/ Clock Placement/ Build Placer Device | Checksum: 1e7cd3b97

Time (s): cpu = 00:00:00 ; elapsed = 00:00:00.168 . Memory (MB): peak = 1693.668 ; gain = 0.000

Phase 1.3 Build Placer Netlist Model
Phase 1.3 Build Placer Netlist Model | Checksum: 2cccf6629

Time (s): cpu = 00:00:00 ; elapsed = 00:00:00.271 . Memory (MB): peak = 1693.668 ; gain = 0.000

Phase 1.4 Constrain Clocks/Macros
Phase 1.4 Constrain Clocks/Macros | Checksum: 2cccf6629

Time (s): cpu = 00:00:00 ; elapsed = 00:00:00.273 . Memory (MB): peak = 1693.668 ; gain = 0.000
Phase 1 Placer Initialization | Checksum: 2cccf6629

Time (s): cpu = 00:00:00 ; elapsed = 00:00:00.275 . Memory (MB): peak = 1693.668 ; gain = 0.000

Phase 2 Global Placement

Phase 2.1 Floorplanning
Phase 2.1 Floorplanning | Checksum: 25b5e37f3

Time (s): cpu = 00:00:00 ; elapsed = 00:00:00.348 . Memory (MB): peak = 1693.668 ; gain = 0.000

Phase 2.2 Update Timing before SLR Path Opt
Phase 2.2 Update Timing before SLR Path Opt | Checksum: 1ff410b22

Time (s): cpu = 00:00:00 ; elapsed = 00:00:00.390 . Memory (MB): peak = 1693.668 ; gain = 0.000

Phase 2.3 Post-Processing in Floorplanning
Phase 2.3 Post-Processing in Floorplanning | Checksum: 1ff410b22

Time (s): cpu = 00:00:00 ; elapsed = 00:00:00.391 . Memory (MB): peak = 1693.668 ; gain = 0.000

Phase 2.4 Global Place Phase1
Phase 2.4 Global Place Phase1 | Checksum: 27bfb2fbb

Time (s): cpu = 00:00:01 ; elapsed = 00:00:02 . Memory (MB): peak = 1693.668 ; gain = 0.000

Phase 2.5 Global Place Phase2

Phase 2.5.1 UpdateTiming Before Physical Synthesis
Phase 2.5.1 UpdateTiming Before Physical Synthesis | Checksum: 200eef549

Time (s): cpu = 00:00:01 ; elapsed = 00:00:02 . Memory (MB): peak = 1693.668 ; gain = 0.000

Phase 2.5.2 Physical Synthesis In Placer
INFO: [Physopt 32-1035] Found 20 LUTNM shape to break, 8 LUT instances to create LUTNM shape
INFO: [Physopt 32-1044] Break lutnm for timing: one critical 1, two critical 19, total 20, new lutff created 2
INFO: [Physopt 32-1138] End 1 Pass. Optimized 23 nets or LUTs. Breaked 20 LUTs, combined 3 existing LUTs and moved 0 existing LUT
INFO: [Physopt 32-65] No nets found for high-fanout optimization.
INFO: [Physopt 32-232] Optimized 0 net. Created 0 new instance.
INFO: [Physopt 32-775] End 1 Pass. Optimized 0 net or cell. Created 0 new cell, deleted 0 existing cell and moved 0 existing cell
INFO: [Physopt 32-456] No candidate cells for DSP register optimization found in the design.
INFO: [Physopt 32-775] End 2 Pass. Optimized 0 net or cell. Created 0 new cell, deleted 0 existing cell and moved 0 existing cell
INFO: [Physopt 32-1123] No candidate cells found for Shift Register to Pipeline optimization
INFO: [Physopt 32-775] End 2 Pass. Optimized 0 net or cell. Created 0 new cell, deleted 0 existing cell and moved 0 existing cell
INFO: [Physopt 32-1401] No candidate cells found for Shift Register optimization.
INFO: [Physopt 32-677] No candidate cells for Shift Register optimization found in the design
INFO: [Physopt 32-775] End 1 Pass. Optimized 0 net or cell. Created 0 new cell, deleted 0 existing cell and moved 0 existing cell
INFO: [Physopt 32-526] No candidate cells for BRAM register optimization found in the design
INFO: [Physopt 32-775] End 1 Pass. Optimized 0 net or cell. Created 0 new cell, deleted 0 existing cell and moved 0 existing cell
INFO: [Physopt 32-846] No candidate cells for URAM register optimization found in the design
INFO: [Physopt 32-775] End 1 Pass. Optimized 0 net or cell. Created 0 new cell, deleted 0 existing cell and moved 0 existing cell
INFO: [Physopt 32-846] No candidate cells for URAM register optimization found in the design
INFO: [Physopt 32-775] End 1 Pass. Optimized 0 net or cell. Created 0 new cell, deleted 0 existing cell and moved 0 existing cell
INFO: [Physopt 32-949] No candidate nets found for dynamic/static region interface net replication
INFO: [Physopt 32-775] End 1 Pass. Optimized 0 net or cell. Created 0 new cell, deleted 0 existing cell and moved 0 existing cell
Netlist sorting complete. Time (s): cpu = 00:00:00 ; elapsed = 00:00:00 . Memory (MB): peak = 1693.668 ; gain = 0.000

Summary of Physical Synthesis Optimizations
============================================


-----------------------------------------------------------------------------------------------------------------------------------------------------------
|  Optimization                                     |  Added Cells  |  Removed Cells  |  Optimized Cells/Nets  |  Dont Touch  |  Iterations  |  Elapsed   |
-----------------------------------------------------------------------------------------------------------------------------------------------------------
|  LUT Combining                                    |           20  |              3  |                    23  |           0  |           1  |  00:00:00  |
|  Retime                                           |            0  |              0  |                     0  |           0  |           1  |  00:00:00  |
|  Very High Fanout                                 |            0  |              0  |                     0  |           0  |           1  |  00:00:00  |
|  DSP Register                                     |            0  |              0  |                     0  |           0  |           1  |  00:00:00  |
|  Shift Register to Pipeline                       |            0  |              0  |                     0  |           0  |           1  |  00:00:00  |
|  Shift Register                                   |            0  |              0  |                     0  |           0  |           1  |  00:00:00  |
|  BRAM Register                                    |            0  |              0  |                     0  |           0  |           1  |  00:00:00  |
|  URAM Register                                    |            0  |              0  |                     0  |           0  |           1  |  00:00:00  |
|  Dynamic/Static Region Interface Net Replication  |            0  |              0  |                     0  |           0  |           1  |  00:00:00  |
|  Total                                            |           20  |              3  |                    23  |           0  |           9  |  00:00:00  |
-----------------------------------------------------------------------------------------------------------------------------------------------------------


Phase 2.5.2 Physical Synthesis In Placer | Checksum: 2cadc7e6f

Time (s): cpu = 00:00:01 ; elapsed = 00:00:02 . Memory (MB): peak = 1693.668 ; gain = 0.000
Phase 2.5 Global Place Phase2 | Checksum: 32ac5f467

Time (s): cpu = 00:00:01 ; elapsed = 00:00:02 . Memory (MB): peak = 1693.668 ; gain = 0.000
Phase 2 Global Placement | Checksum: 32ac5f467

Time (s): cpu = 00:00:01 ; elapsed = 00:00:02 . Memory (MB): peak = 1693.668 ; gain = 0.000

Phase 3 Detail Placement

Phase 3.1 Commit Multi Column Macros
Phase 3.1 Commit Multi Column Macros | Checksum: 25729bccc

Time (s): cpu = 00:00:01 ; elapsed = 00:00:02 . Memory (MB): peak = 1693.668 ; gain = 0.000

Phase 3.2 Commit Most Macros & LUTRAMs
Phase 3.2 Commit Most Macros & LUTRAMs | Checksum: 26e246a75

Time (s): cpu = 00:00:01 ; elapsed = 00:00:02 . Memory (MB): peak = 1693.668 ; gain = 0.000

Phase 3.3 Area Swap Optimization
Phase 3.3 Area Swap Optimization | Checksum: 26697b1d5

Time (s): cpu = 00:00:01 ; elapsed = 00:00:02 . Memory (MB): peak = 1693.668 ; gain = 0.000

Phase 3.4 Pipeline Register Optimization
Phase 3.4 Pipeline Register Optimization | Checksum: 3186657ce

Time (s): cpu = 00:00:01 ; elapsed = 00:00:02 . Memory (MB): peak = 1693.668 ; gain = 0.000

Phase 3.5 Fast Optimization
Phase 3.5 Fast Optimization | Checksum: 2d582adc9

Time (s): cpu = 00:00:01 ; elapsed = 00:00:03 . Memory (MB): peak = 1693.668 ; gain = 0.000

Phase 3.6 Small Shape Detail Placement
Phase 3.6 Small Shape Detail Placement | Checksum: 2eaf0b8be

Time (s): cpu = 00:00:01 ; elapsed = 00:00:03 . Memory (MB): peak = 1693.668 ; gain = 0.000

Phase 3.7 Re-assign LUT pins
Phase 3.7 Re-assign LUT pins | Checksum: 2eabdf95e

Time (s): cpu = 00:00:01 ; elapsed = 00:00:03 . Memory (MB): peak = 1693.668 ; gain = 0.000

Phase 3.8 Pipeline Register Optimization
Phase 3.8 Pipeline Register Optimization | Checksum: 22d63dea5

Time (s): cpu = 00:00:01 ; elapsed = 00:00:03 . Memory (MB): peak = 1693.668 ; gain = 0.000

Phase 3.9 Fast Optimization
Phase 3.9 Fast Optimization | Checksum: 2e2d683e9

Time (s): cpu = 00:00:02 ; elapsed = 00:00:05 . Memory (MB): peak = 1693.668 ; gain = 0.000
Phase 3 Detail Placement | Checksum: 2e2d683e9

Time (s): cpu = 00:00:02 ; elapsed = 00:00:05 . Memory (MB): peak = 1693.668 ; gain = 0.000

Phase 4 Post Placement Optimization and Clean-Up

Phase 4.1 Post Commit Optimization
INFO: [Timing 38-35] Done setting XDC timing constraints.

Phase 4.1.1 Post Placement Optimization
Post Placement Optimization Initialization | Checksum: 335b2bccd

Phase 4.1.1.1 BUFG Insertion

Starting Physical Synthesis Task

Phase 1 Physical Synthesis Initialization
INFO: [Physopt 32-721] Multithreading enabled for phys_opt_design using a maximum of 2 CPUs
INFO: [Physopt 32-619] Estimated Timing Summary | WNS=-3.368 | TNS=-45.270 |
Phase 1 Physical Synthesis Initialization | Checksum: 2574318d4

Time (s): cpu = 00:00:00 ; elapsed = 00:00:00.015 . Memory (MB): peak = 1703.090 ; gain = 0.000
INFO: [Place 46-56] BUFG insertion identified 0 candidate nets. Inserted BUFG: 0, Replicated BUFG Driver: 0, Skipped due to Placement/Routing Conflicts: 0, Skipped due to Timing Degradation: 0, Skipped due to netlist editing failed: 0.
Ending Physical Synthesis Task | Checksum: 323ed1489

Time (s): cpu = 00:00:00 ; elapsed = 00:00:00.017 . Memory (MB): peak = 1703.090 ; gain = 0.000
Phase 4.1.1.1 BUFG Insertion | Checksum: 335b2bccd

Time (s): cpu = 00:00:02 ; elapsed = 00:00:05 . Memory (MB): peak = 1703.090 ; gain = 9.422

Phase 4.1.1.2 Post Placement Timing Optimization
INFO: [Place 30-746] Post Placement Timing Summary WNS=-1.756. For the most accurate timing information please run report_timing.
Phase 4.1.1.2 Post Placement Timing Optimization | Checksum: 1ff8b9b05

Time (s): cpu = 00:00:03 ; elapsed = 00:00:10 . Memory (MB): peak = 1703.090 ; gain = 9.422

Time (s): cpu = 00:00:03 ; elapsed = 00:00:10 . Memory (MB): peak = 1703.090 ; gain = 9.422
Phase 4.1 Post Commit Optimization | Checksum: 1ff8b9b05

Time (s): cpu = 00:00:03 ; elapsed = 00:00:10 . Memory (MB): peak = 1703.090 ; gain = 9.422

Phase 4.2 Post Placement Cleanup
Phase 4.2 Post Placement Cleanup | Checksum: 1ff8b9b05

Time (s): cpu = 00:00:03 ; elapsed = 00:00:10 . Memory (MB): peak = 1703.090 ; gain = 9.422

Phase 4.3 Placer Reporting

Phase 4.3.1 Print Estimated Congestion
INFO: [Place 30-612] Post-Placement Estimated Congestion 
 ____________________________________________________
|           | Global Congestion | Short Congestion  |
| Direction | Region Size       | Region Size       |
|___________|___________________|___________________|
|      North|                1x1|                1x1|
|___________|___________________|___________________|
|      South|                1x1|                1x1|
|___________|___________________|___________________|
|       East|                1x1|                1x1|
|___________|___________________|___________________|
|       West|                1x1|                1x1|
|___________|___________________|___________________|

Phase 4.3.1 Print Estimated Congestion | Checksum: 1ff8b9b05

Time (s): cpu = 00:00:03 ; elapsed = 00:00:10 . Memory (MB): peak = 1703.090 ; gain = 9.422
Phase 4.3 Placer Reporting | Checksum: 1ff8b9b05

Time (s): cpu = 00:00:03 ; elapsed = 00:00:10 . Memory (MB): peak = 1703.090 ; gain = 9.422

Phase 4.4 Final Placement Cleanup
Netlist sorting complete. Time (s): cpu = 00:00:00 ; elapsed = 00:00:00 . Memory (MB): peak = 1703.090 ; gain = 0.000

Time (s): cpu = 00:00:03 ; elapsed = 00:00:10 . Memory (MB): peak = 1703.090 ; gain = 9.422
Phase 4 Post Placement Optimization and Clean-Up | Checksum: 22c1e0db3

Time (s): cpu = 00:00:03 ; elapsed = 00:00:10 . Memory (MB): peak = 1703.090 ; gain = 9.422
Ending Placer Task | Checksum: 21265202a

Time (s): cpu = 00:00:03 ; elapsed = 00:00:10 . Memory (MB): peak = 1703.090 ; gain = 9.422
72 Infos, 0 Warnings, 0 Critical Warnings and 0 Errors encountered.
place_design completed successfully
place_design: Time (s): cpu = 00:00:04 ; elapsed = 00:00:11 . Memory (MB): peak = 1703.090 ; gain = 9.422
INFO: [Vivado 12-24838] Running report commands "report_control_sets, report_io, report_utilization" in parallel.
Running report generation with 2 threads.
INFO: [Vivado 12-24828] Executing command : report_utilization -file top_utilization_placed.rpt -pb top_utilization_placed.pb
INFO: [Vivado 12-24828] Executing command : report_io -file top_io_placed.rpt
report_io: Time (s): cpu = 00:00:00 ; elapsed = 00:00:00.044 . Memory (MB): peak = 1703.090 ; gain = 0.000
INFO: [Vivado 12-24828] Executing command : report_control_sets -verbose -file top_control_sets_placed.rpt
report_control_sets: Time (s): cpu = 00:00:00 ; elapsed = 00:00:00.002 . Memory (MB): peak = 1703.090 ; gain = 0.000
INFO: [Timing 38-480] Writing timing data to binary archive.
Write ShapeDB Complete: Time (s): cpu = 00:00:00 ; elapsed = 00:00:00.001 . Memory (MB): peak = 1704.258 ; gain = 0.000
Wrote PlaceDB: Time (s): cpu = 00:00:00 ; elapsed = 00:00:00.024 . Memory (MB): peak = 1704.258 ; gain = 0.000
Wrote PulsedLatchDB: Time (s): cpu = 00:00:00 ; elapsed = 00:00:00 . Memory (MB): peak = 1704.258 ; gain = 0.000
Writing XDEF routing.
Writing XDEF routing logical nets.
Writing XDEF routing special nets.
Wrote RouteStorage: Time (s): cpu = 00:00:00 ; elapsed = 00:00:00.010 . Memory (MB): peak = 1704.258 ; gain = 0.000
Wrote Netlist Cache: Time (s): cpu = 00:00:00 ; elapsed = 00:00:00.001 . Memory (MB): peak = 1704.258 ; gain = 0.000
Wrote Device Cache: Time (s): cpu = 00:00:00 ; elapsed = 00:00:00.004 . Memory (MB): peak = 1704.258 ; gain = 0.000
Write Physdb Complete: Time (s): cpu = 00:00:00 ; elapsed = 00:00:00.042 . Memory (MB): peak = 1704.258 ; gain = 0.000
INFO: [Common 17-1381] The checkpoint 'C:/Users/Allen/Vivado Projects/FPGA-Blackjack/FPGA_Blackjack.runs/impl_1/top_placed.dcp' has been generated.
Command: phys_opt_design
Attempting to get a license for feature 'Implementation' and/or device 'xc7a100t'
INFO: [Common 17-349] Got license for feature 'Implementation' and/or device 'xc7a100t'

Starting Initial Update Timing Task

Time (s): cpu = 00:00:00 ; elapsed = 00:00:00.045 . Memory (MB): peak = 1718.812 ; gain = 14.555
INFO: [Vivado_Tcl 4-1435] PhysOpt_Tcl_Interface Runtime Before Starting Physical Synthesis Task | CPU: 0.00s |  WALL: 0.05s
Netlist sorting complete. Time (s): cpu = 00:00:00 ; elapsed = 00:00:00 . Memory (MB): peak = 1718.812 ; gain = 0.000

Starting Physical Synthesis Task

Phase 1 Physical Synthesis Initialization
INFO: [Physopt 32-721] Multithreading enabled for phys_opt_design using a maximum of 2 CPUs
INFO: [Physopt 32-619] Estimated Timing Summary | WNS=-1.756 | TNS=-22.780 |
Phase 1 Physical Synthesis Initialization | Checksum: 220b24885

Time (s): cpu = 00:00:00 ; elapsed = 00:00:00.071 . Memory (MB): peak = 1718.812 ; gain = 0.000
INFO: [Physopt 32-619] Estimated Timing Summary | WNS=-1.756 | TNS=-22.780 |

Phase 2 DSP Register Optimization
INFO: [Physopt 32-456] No candidate cells for DSP register optimization found in the design.
INFO: [Physopt 32-775] End 2 Pass. Optimized 0 net or cell. Created 0 new cell, deleted 0 existing cell and moved 0 existing cell
Phase 2 DSP Register Optimization | Checksum: 220b24885

Time (s): cpu = 00:00:00 ; elapsed = 00:00:00.073 . Memory (MB): peak = 1718.812 ; gain = 0.000

Phase 3 Critical Path Optimization
INFO: [Physopt 32-619] Estimated Timing Summary | WNS=-1.756 | TNS=-22.780 |
INFO: [Physopt 32-702] Processed net dealer/ace_count_reg_n_0_[1]. Optimizations did not improve timing on the net.
INFO: [Physopt 32-702] Processed net rng/lfsr_reg_n_0_[12]. Optimizations did not improve timing on the net.
INFO: [Physopt 32-702] Processed net dealer/ace_count[2]_i_2_n_0. Optimizations did not improve timing on the net.
INFO: [Physopt 32-710] Processed net dealer/ace_count[2]_i_2_n_0. Critical path length was reduced through logic transformation on cell dealer/ace_count[2]_i_2_comp.
INFO: [Physopt 32-735] Processed net dealer/ace_count_reg[2]_0. Optimization improves timing on the net.
INFO: [Physopt 32-619] Estimated Timing Summary | WNS=-1.715 | TNS=-21.038 |
INFO: [Physopt 32-702] Processed net dealer/Q[4]. Optimizations did not improve timing on the net.
INFO: [Physopt 32-710] Processed net dealer/score[4]_i_1_n_0. Critical path length was reduced through logic transformation on cell dealer/score[4]_i_1_comp.
INFO: [Physopt 32-735] Processed net dealer/score[4]_i_4__0_n_0. Optimization improves timing on the net.
INFO: [Physopt 32-619] Estimated Timing Summary | WNS=-1.705 | TNS=-21.029 |
INFO: [Physopt 32-702] Processed net rng/score_reg[2]. Optimizations did not improve timing on the net.
INFO: [Physopt 32-608] Optimized 1 net.  Swapped 12 pins.
INFO: [Physopt 32-735] Processed net dealer/ace_count_reg[2]_0. Optimization improves timing on the net.
INFO: [Physopt 32-619] Estimated Timing Summary | WNS=-1.653 | TNS=-20.473 |
INFO: [Physopt 32-702] Processed net player/ace_count_reg_n_0_[1]. Optimizations did not improve timing on the net.
INFO: [Physopt 32-702] Processed net player/ace_count. Optimizations did not improve timing on the net.
INFO: [Physopt 32-710] Processed net player/ace_count. Critical path length was reduced through logic transformation on cell player/ace_count[2]_i_2__0_comp.
INFO: [Physopt 32-735] Processed net player/ace_count_reg[2]_0. Optimization improves timing on the net.
INFO: [Physopt 32-619] Estimated Timing Summary | WNS=-1.641 | TNS=-18.329 |
INFO: [Physopt 32-702] Processed net player/Q[3]. Optimizations did not improve timing on the net.
INFO: [Physopt 32-663] Processed net player/score[3]_i_2__0_n_0.  Re-placed instance player/score[3]_i_2__0
INFO: [Physopt 32-735] Processed net player/score[3]_i_2__0_n_0. Optimization improves timing on the net.
INFO: [Physopt 32-619] Estimated Timing Summary | WNS=-1.635 | TNS=-18.317 |
INFO: [Physopt 32-702] Processed net player/Q[4]. Optimizations did not improve timing on the net.
INFO: [Physopt 32-710] Processed net player/p_0_in[4]. Critical path length was reduced through logic transformation on cell player/score[4]_i_1__0_comp.
INFO: [Physopt 32-735] Processed net player/score[4]_i_3__0_n_0. Optimization improves timing on the net.
INFO: [Physopt 32-619] Estimated Timing Summary | WNS=-1.629 | TNS=-18.210 |
INFO: [Physopt 32-710] Processed net player/p_0_in[3]. Critical path length was reduced through logic transformation on cell player/score[3]_i_1__0_comp.
INFO: [Physopt 32-735] Processed net player/score[3]_i_2__0_n_0. Optimization improves timing on the net.
INFO: [Physopt 32-619] Estimated Timing Summary | WNS=-1.566 | TNS=-18.107 |
INFO: [Physopt 32-702] Processed net dealer/ace_count_reg[2]_0. Optimizations did not improve timing on the net.
INFO: [Physopt 32-710] Processed net dealer/ace_count_reg[2]_0. Critical path length was reduced through logic transformation on cell dealer/score[4]_i_10_comp_1.
INFO: [Physopt 32-735] Processed net rng/score_reg[3]. Optimization improves timing on the net.
INFO: [Physopt 32-619] Estimated Timing Summary | WNS=-1.550 | TNS=-17.725 |
INFO: [Physopt 32-702] Processed net dealer/ace_count_reg[0]_0. Optimizations did not improve timing on the net.
INFO: [Physopt 32-702] Processed net rng/score_reg[3]. Optimizations did not improve timing on the net.
INFO: [Physopt 32-702] Processed net rng/score[4]_i_12_n_0. Optimizations did not improve timing on the net.
INFO: [Physopt 32-702] Processed net rng/lfsr_reg[1]_0[1]. Optimizations did not improve timing on the net.
INFO: [Physopt 32-608] Optimized 1 net.  Swapped 20 pins.
INFO: [Physopt 32-735] Processed net rng/saved_card[3]_i_5_n_0. Optimization improves timing on the net.
INFO: [Physopt 32-619] Estimated Timing Summary | WNS=-1.382 | TNS=-15.503 |
INFO: [Physopt 32-608] Optimized 1 net.  Swapped 24 pins.
INFO: [Physopt 32-735] Processed net rng/lfsr_reg[1]_0[0]. Optimization improves timing on the net.
INFO: [Physopt 32-619] Estimated Timing Summary | WNS=-1.372 | TNS=-15.351 |
INFO: [Physopt 32-702] Processed net rng/score_reg[2]_0. Optimizations did not improve timing on the net.
INFO: [Physopt 32-608] Optimized 1 net.  Swapped 24 pins.
INFO: [Physopt 32-735] Processed net player/ace_count_reg[2]_0. Optimization improves timing on the net.
INFO: [Physopt 32-619] Estimated Timing Summary | WNS=-1.345 | TNS=-14.454 |
INFO: [Physopt 32-702] Processed net player/ace_count_reg[0]_0. Optimizations did not improve timing on the net.
INFO: [Physopt 32-702] Processed net rng/score_reg[3]_0. Optimizations did not improve timing on the net.
INFO: [Physopt 32-702] Processed net rng/score[4]_i_10__0_n_0. Optimizations did not improve timing on the net.
INFO: [Physopt 32-663] Processed net rng/card_val[0].  Re-placed instance rng/score[0]_i_2
INFO: [Physopt 32-735] Processed net rng/card_val[0]. Optimization improves timing on the net.
INFO: [Physopt 32-619] Estimated Timing Summary | WNS=-1.344 | TNS=-14.496 |
INFO: [Physopt 32-702] Processed net rng/saved_card[3]_i_3_n_0. Optimizations did not improve timing on the net.
INFO: [Physopt 32-702] Processed net rng/saved_card[3]_i_9_n_0. Optimizations did not improve timing on the net.
INFO: [Physopt 32-608] Optimized 1 net.  Swapped 20 pins.
INFO: [Physopt 32-735] Processed net rng/saved_card[3]_i_16_n_0. Optimization improves timing on the net.
INFO: [Physopt 32-619] Estimated Timing Summary | WNS=-1.324 | TNS=-14.196 |
INFO: [Physopt 32-81] Processed net rng/lfsr_reg_n_0_[10]. Replicated 1 times.
INFO: [Physopt 32-735] Processed net rng/lfsr_reg_n_0_[10]. Optimization improves timing on the net.
INFO: [Physopt 32-619] Estimated Timing Summary | WNS=-1.324 | TNS=-14.196 |
INFO: [Physopt 32-702] Processed net rng/saved_card[3]_i_15_n_0. Optimizations did not improve timing on the net.
INFO: [Physopt 32-702] Processed net rng/saved_card[3]_i_14_n_0. Optimizations did not improve timing on the net.
INFO: [Physopt 32-608] Optimized 1 net.  Swapped 16 pins.
INFO: [Physopt 32-735] Processed net rng/saved_card[3]_i_22_n_0. Optimization improves timing on the net.
INFO: [Physopt 32-619] Estimated Timing Summary | WNS=-1.317 | TNS=-13.671 |
INFO: [Physopt 32-702] Processed net rng/lfsr_reg_n_0_[10]_repN. Optimizations did not improve timing on the net.
INFO: [Physopt 32-608] Optimized 1 net.  Swapped 23 pins.
INFO: [Physopt 32-735] Processed net rng/saved_card[3]_i_10_n_0. Optimization improves timing on the net.
INFO: [Physopt 32-619] Estimated Timing Summary | WNS=-1.275 | TNS=-13.461 |
INFO: [Physopt 32-702] Processed net rng/saved_card[3]_i_11_n_0. Optimizations did not improve timing on the net.
INFO: [Physopt 32-608] Optimized 1 net.  Swapped 19 pins.
INFO: [Physopt 32-735] Processed net rng/saved_card[3]_i_18_n_0. Optimization improves timing on the net.
INFO: [Physopt 32-619] Estimated Timing Summary | WNS=-1.239 | TNS=-12.921 |
INFO: [Physopt 32-702] Processed net rng/saved_card[3]_i_21_n_0. Optimizations did not improve timing on the net.
INFO: [Physopt 32-710] Processed net rng/saved_card[3]_i_21_n_0. Critical path length was reduced through logic transformation on cell rng/saved_card[3]_i_21_comp.
INFO: [Physopt 32-735] Processed net rng/saved_card[3]_i_24_n_0. Optimization improves timing on the net.
INFO: [Physopt 32-619] Estimated Timing Summary | WNS=-1.189 | TNS=-12.174 |
INFO: [Physopt 32-702] Processed net rng/saved_card[3]_i_20_n_0. Optimizations did not improve timing on the net.
INFO: [Physopt 32-702] Processed net rng/saved_card[3]_i_24_n_0. Optimizations did not improve timing on the net.
INFO: [Physopt 32-608] Optimized 1 net.  Swapped 23 pins.
INFO: [Physopt 32-735] Processed net rng/saved_card[3]_i_30_n_0. Optimization improves timing on the net.
INFO: [Physopt 32-619] Estimated Timing Summary | WNS=-1.137 | TNS=-11.446 |
INFO: [Physopt 32-702] Processed net rng/saved_card[3]_i_17_n_0. Optimizations did not improve timing on the net.
INFO: [Physopt 32-702] Processed net rng/saved_card[3]_i_19_n_0. Optimizations did not improve timing on the net.
INFO: [Physopt 32-608] Optimized 1 net.  Swapped 16 pins.
INFO: [Physopt 32-735] Processed net rng/saved_card[3]_i_26_n_0. Optimization improves timing on the net.
INFO: [Physopt 32-619] Estimated Timing Summary | WNS=-1.115 | TNS=-11.138 |
INFO: [Physopt 32-702] Processed net rng/saved_card[3]_i_28_n_0. Optimizations did not improve timing on the net.
INFO: [Physopt 32-702] Processed net rng/saved_card[3]_i_33_n_0. Optimizations did not improve timing on the net.
INFO: [Physopt 32-702] Processed net rng/saved_card[3]_i_36_n_0. Optimizations did not improve timing on the net.
INFO: [Physopt 32-702] Processed net rng/saved_card[3]_i_41_n_0. Optimizations did not improve timing on the net.
INFO: [Physopt 32-702] Processed net dealer/score[4]_i_1_n_0. Optimizations did not improve timing on the net.
INFO: [Physopt 32-702] Processed net sys_clk_IBUF. Optimizations did not improve timing on the net.
INFO: [Physopt 32-702] Processed net sys_clk. Optimizations did not improve timing on the net.
INFO: [Physopt 32-702] Processed net dealer/Q[4]. Optimizations did not improve timing on the net.
INFO: [Physopt 32-702] Processed net rng/lfsr_reg_n_0_[10]_repN. Optimizations did not improve timing on the net.
INFO: [Physopt 32-702] Processed net rng/score_reg[2]. Optimizations did not improve timing on the net.
INFO: [Physopt 32-702] Processed net dealer/ace_count_reg[0]_0. Optimizations did not improve timing on the net.
INFO: [Physopt 32-702] Processed net rng/score_reg[3]. Optimizations did not improve timing on the net.
INFO: [Physopt 32-702] Processed net rng/score[4]_i_12_n_0. Optimizations did not improve timing on the net.
INFO: [Physopt 32-702] Processed net rng/lfsr_reg[1]_0[1]. Optimizations did not improve timing on the net.
INFO: [Physopt 32-702] Processed net rng/saved_card[3]_i_3_n_0. Optimizations did not improve timing on the net.
INFO: [Physopt 32-702] Processed net rng/saved_card[3]_i_9_n_0. Optimizations did not improve timing on the net.
INFO: [Physopt 32-702] Processed net rng/saved_card[3]_i_15_n_0. Optimizations did not improve timing on the net.
INFO: [Physopt 32-702] Processed net rng/saved_card[3]_i_14_n_0. Optimizations did not improve timing on the net.
INFO: [Physopt 32-702] Processed net rng/saved_card[3]_i_20_n_0. Optimizations did not improve timing on the net.
INFO: [Physopt 32-702] Processed net rng/saved_card[3]_i_24_n_0. Optimizations did not improve timing on the net.
INFO: [Physopt 32-702] Processed net rng/saved_card[3]_i_28_n_0. Optimizations did not improve timing on the net.
INFO: [Physopt 32-702] Processed net rng/saved_card[3]_i_33_n_0. Optimizations did not improve timing on the net.
INFO: [Physopt 32-702] Processed net rng/saved_card[3]_i_36_n_0. Optimizations did not improve timing on the net.
INFO: [Physopt 32-702] Processed net rng/saved_card[3]_i_41_n_0. Optimizations did not improve timing on the net.
INFO: [Physopt 32-702] Processed net dealer/score[4]_i_1_n_0. Optimizations did not improve timing on the net.
INFO: [Physopt 32-702] Processed net sys_clk_IBUF. Optimizations did not improve timing on the net.
INFO: [Physopt 32-702] Processed net sys_clk. Optimizations did not improve timing on the net.
INFO: [Physopt 32-619] Estimated Timing Summary | WNS=-1.115 | TNS=-11.138 |
Netlist sorting complete. Time (s): cpu = 00:00:00 ; elapsed = 00:00:00.002 . Memory (MB): peak = 1727.836 ; gain = 0.000
Phase 3 Critical Path Optimization | Checksum: 220b24885

Time (s): cpu = 00:00:01 ; elapsed = 00:00:03 . Memory (MB): peak = 1727.836 ; gain = 9.023

Phase 4 Critical Path Optimization
INFO: [Physopt 32-619] Estimated Timing Summary | WNS=-1.115 | TNS=-11.138 |
INFO: [Physopt 32-702] Processed net dealer/Q[4]. Optimizations did not improve timing on the net.
INFO: [Physopt 32-702] Processed net rng/lfsr_reg_n_0_[10]_repN. Optimizations did not improve timing on the net.
INFO: [Physopt 32-702] Processed net rng/score_reg[2]. Optimizations did not improve timing on the net.
INFO: [Physopt 32-702] Processed net dealer/ace_count_reg[0]_0. Optimizations did not improve timing on the net.
INFO: [Physopt 32-702] Processed net rng/score_reg[3]. Optimizations did not improve timing on the net.
INFO: [Physopt 32-702] Processed net rng/score[4]_i_12_n_0. Optimizations did not improve timing on the net.
INFO: [Physopt 32-702] Processed net rng/lfsr_reg[1]_0[1]. Optimizations did not improve timing on the net.
INFO: [Physopt 32-702] Processed net rng/saved_card[3]_i_3_n_0. Optimizations did not improve timing on the net.
INFO: [Physopt 32-702] Processed net rng/saved_card[3]_i_9_n_0. Optimizations did not improve timing on the net.
INFO: [Physopt 32-702] Processed net rng/saved_card[3]_i_15_n_0. Optimizations did not improve timing on the net.
INFO: [Physopt 32-702] Processed net rng/saved_card[3]_i_14_n_0. Optimizations did not improve timing on the net.
INFO: [Physopt 32-702] Processed net rng/saved_card[3]_i_20_n_0. Optimizations did not improve timing on the net.
INFO: [Physopt 32-702] Processed net rng/saved_card[3]_i_24_n_0. Optimizations did not improve timing on the net.
INFO: [Physopt 32-702] Processed net rng/saved_card[3]_i_28_n_0. Optimizations did not improve timing on the net.
INFO: [Physopt 32-702] Processed net rng/saved_card[3]_i_33_n_0. Optimizations did not improve timing on the net.
INFO: [Physopt 32-702] Processed net rng/saved_card[3]_i_36_n_0. Optimizations did not improve timing on the net.
INFO: [Physopt 32-702] Processed net rng/saved_card[3]_i_41_n_0. Optimizations did not improve timing on the net.
INFO: [Physopt 32-702] Processed net dealer/score[4]_i_1_n_0. Optimizations did not improve timing on the net.
INFO: [Physopt 32-702] Processed net sys_clk_IBUF. Optimizations did not improve timing on the net.
INFO: [Physopt 32-702] Processed net sys_clk. Optimizations did not improve timing on the net.
INFO: [Physopt 32-702] Processed net dealer/Q[4]. Optimizations did not improve timing on the net.
INFO: [Physopt 32-702] Processed net rng/lfsr_reg_n_0_[10]_repN. Optimizations did not improve timing on the net.
INFO: [Physopt 32-702] Processed net rng/score_reg[2]. Optimizations did not improve timing on the net.
INFO: [Physopt 32-702] Processed net dealer/ace_count_reg[0]_0. Optimizations did not improve timing on the net.
INFO: [Physopt 32-702] Processed net rng/score_reg[3]. Optimizations did not improve timing on the net.
INFO: [Physopt 32-702] Processed net rng/score[4]_i_12_n_0. Optimizations did not improve timing on the net.
INFO: [Physopt 32-702] Processed net rng/lfsr_reg[1]_0[1]. Optimizations did not improve timing on the net.
INFO: [Physopt 32-702] Processed net rng/saved_card[3]_i_3_n_0. Optimizations did not improve timing on the net.
INFO: [Physopt 32-702] Processed net rng/saved_card[3]_i_9_n_0. Optimizations did not improve timing on the net.
INFO: [Physopt 32-702] Processed net rng/saved_card[3]_i_15_n_0. Optimizations did not improve timing on the net.
INFO: [Physopt 32-702] Processed net rng/saved_card[3]_i_14_n_0. Optimizations did not improve timing on the net.
INFO: [Physopt 32-702] Processed net rng/saved_card[3]_i_20_n_0. Optimizations did not improve timing on the net.
INFO: [Physopt 32-702] Processed net rng/saved_card[3]_i_24_n_0. Optimizations did not improve timing on the net.
INFO: [Physopt 32-702] Processed net rng/saved_card[3]_i_28_n_0. Optimizations did not improve timing on the net.
INFO: [Physopt 32-702] Processed net rng/saved_card[3]_i_33_n_0. Optimizations did not improve timing on the net.
INFO: [Physopt 32-702] Processed net rng/saved_card[3]_i_36_n_0. Optimizations did not improve timing on the net.
INFO: [Physopt 32-702] Processed net rng/saved_card[3]_i_41_n_0. Optimizations did not improve timing on the net.
INFO: [Physopt 32-702] Processed net dealer/score[4]_i_1_n_0. Optimizations did not improve timing on the net.
INFO: [Physopt 32-702] Processed net sys_clk_IBUF. Optimizations did not improve timing on the net.
INFO: [Physopt 32-702] Processed net sys_clk. Optimizations did not improve timing on the net.
INFO: [Physopt 32-619] Estimated Timing Summary | WNS=-1.115 | TNS=-11.138 |
Netlist sorting complete. Time (s): cpu = 00:00:00 ; elapsed = 00:00:00.001 . Memory (MB): peak = 1727.836 ; gain = 0.000
Phase 4 Critical Path Optimization | Checksum: 220b24885

Time (s): cpu = 00:00:01 ; elapsed = 00:00:04 . Memory (MB): peak = 1727.836 ; gain = 9.023
Netlist sorting complete. Time (s): cpu = 00:00:00 ; elapsed = 00:00:00 . Memory (MB): peak = 1727.836 ; gain = 0.000
INFO: [Physopt 32-603] Post Physical Optimization Timing Summary | WNS=-1.115 | TNS=-11.138 |

Summary of Physical Synthesis Optimizations
============================================


-------------------------------------------------------------------------------------------------------------------------------------------------------------
|  Optimization   |  WNS Gain (ns)  |  TNS Gain (ns)  |  Added Cells  |  Removed Cells  |  Optimized Cells/Nets  |  Dont Touch  |  Iterations  |  Elapsed   |
-------------------------------------------------------------------------------------------------------------------------------------------------------------
|  DSP Register   |          0.000  |          0.000  |            0  |              0  |                     0  |           0  |           1  |  00:00:00  |
|  Critical Path  |          0.641  |         11.642  |            1  |              0  |                    20  |           0  |           2  |  00:00:03  |
|  Total          |          0.641  |         11.642  |            1  |              0  |                    20  |           0  |           3  |  00:00:03  |
-------------------------------------------------------------------------------------------------------------------------------------------------------------


Netlist sorting complete. Time (s): cpu = 00:00:00 ; elapsed = 00:00:00 . Memory (MB): peak = 1727.836 ; gain = 0.000
Ending Physical Synthesis Task | Checksum: 307e85fed

Time (s): cpu = 00:00:01 ; elapsed = 00:00:04 . Memory (MB): peak = 1727.836 ; gain = 9.023
INFO: [Common 17-83] Releasing license: Implementation
247 Infos, 0 Warnings, 0 Critical Warnings and 0 Errors encountered.
phys_opt_design completed successfully
INFO: [Timing 38-480] Writing timing data to binary archive.
Write ShapeDB Complete: Time (s): cpu = 00:00:00 ; elapsed = 00:00:00.001 . Memory (MB): peak = 1736.621 ; gain = 0.008
Wrote PlaceDB: Time (s): cpu = 00:00:00 ; elapsed = 00:00:00.026 . Memory (MB): peak = 1736.621 ; gain = 0.000
Wrote PulsedLatchDB: Time (s): cpu = 00:00:00 ; elapsed = 00:00:00 . Memory (MB): peak = 1736.621 ; gain = 0.000
Writing XDEF routing.
Writing XDEF routing logical nets.
Writing XDEF routing special nets.
Wrote RouteStorage: Time (s): cpu = 00:00:00 ; elapsed = 00:00:00.009 . Memory (MB): peak = 1736.621 ; gain = 0.000
Wrote Netlist Cache: Time (s): cpu = 00:00:00 ; elapsed = 00:00:00.001 . Memory (MB): peak = 1736.621 ; gain = 0.000
Wrote Device Cache: Time (s): cpu = 00:00:00 ; elapsed = 00:00:00.004 . Memory (MB): peak = 1736.621 ; gain = 0.000
Write Physdb Complete: Time (s): cpu = 00:00:00 ; elapsed = 00:00:00.044 . Memory (MB): peak = 1736.621 ; gain = 0.000
INFO: [Common 17-1381] The checkpoint 'C:/Users/Allen/Vivado Projects/FPGA-Blackjack/FPGA_Blackjack.runs/impl_1/top_physopt.dcp' has been generated.
Command: route_design
Attempting to get a license for feature 'Implementation' and/or device 'xc7a100t'
INFO: [Common 17-349] Got license for feature 'Implementation' and/or device 'xc7a100t'
INFO: [DRC 23-27] Running DRC with 2 threads
INFO: [Vivado_Tcl 4-198] DRC finished with 0 Errors
INFO: [Vivado_Tcl 4-199] Please refer to the DRC report (report_drc) for more information.


Starting Routing Task
INFO: [Route 35-254] Multithreading enabled for route_design using a maximum of 2 CPUs

Phase 1 Build RT Design
Checksum: PlaceDB: cac741e9 ConstDB: 0 ShapeSum: a9931de4 RouteDB: b1d25f96
Post Restoration Checksum: NetGraph: 18a780ff | NumContArr: 13f34073 | Constraints: c2a8fa9d | Timing: c2a8fa9d
Phase 1 Build RT Design | Checksum: 1b1ecb6ac

Time (s): cpu = 00:00:05 ; elapsed = 00:00:20 . Memory (MB): peak = 1863.676 ; gain = 118.062

Phase 2 Router Initialization

Phase 2.1 Fix Topology Constraints
Phase 2.1 Fix Topology Constraints | Checksum: 1b1ecb6ac

Time (s): cpu = 00:00:05 ; elapsed = 00:00:20 . Memory (MB): peak = 1863.676 ; gain = 118.062

Phase 2.2 Pre Route Cleanup
Phase 2.2 Pre Route Cleanup | Checksum: 1b1ecb6ac

Time (s): cpu = 00:00:05 ; elapsed = 00:00:20 . Memory (MB): peak = 1863.676 ; gain = 118.062
 Number of Nodes with overlaps = 0

Phase 2.3 Update Timing
Phase 2.3 Update Timing | Checksum: 19e443a55

Time (s): cpu = 00:00:05 ; elapsed = 00:00:20 . Memory (MB): peak = 1905.344 ; gain = 159.730
INFO: [Route 35-416] Intermediate Timing Summary | WNS=-0.915 | TNS=-8.004 | WHS=-0.112 | THS=-3.629 |


Router Utilization Summary
  Global Vertical Routing Utilization    = 0 %
  Global Horizontal Routing Utilization  = 0 %
  Routable Net Status*
  *Does not include unroutable nets such as driverless and loadless.
  Run report_route_status for detailed report.
  Number of Failed Nets               = 496
    (Failed Nets is the sum of unrouted and partially routed nets)
  Number of Unrouted Nets             = 496
  Number of Partially Routed Nets     = 0
  Number of Node Overlaps             = 0

Phase 2 Router Initialization | Checksum: 16e1867ad

Time (s): cpu = 00:00:05 ; elapsed = 00:00:21 . Memory (MB): peak = 1905.344 ; gain = 159.730

Phase 3 Global Routing
Phase 3 Global Routing | Checksum: 16e1867ad

Time (s): cpu = 00:00:05 ; elapsed = 00:00:21 . Memory (MB): peak = 1905.344 ; gain = 159.730

Phase 4 Initial Routing

Phase 4.1 Initial Net Routing Pass
Phase 4.1 Initial Net Routing Pass | Checksum: 21943c569

Time (s): cpu = 00:00:05 ; elapsed = 00:00:21 . Memory (MB): peak = 1905.344 ; gain = 159.730
Phase 4 Initial Routing | Checksum: 21943c569

Time (s): cpu = 00:00:05 ; elapsed = 00:00:21 . Memory (MB): peak = 1905.344 ; gain = 159.730
INFO: [Route 35-580] Design has 10 pins with tight setup and hold constraints.

The top 5 pins with tight setup and hold constraints:

+====================+===================+===========================+
| Launch Setup Clock | Launch Hold Clock | Pin                       |
+====================+===================+===========================+
| sys_clk_pin        | sys_clk_pin       | dealer/score_reg[4]/D     |
| sys_clk_pin        | sys_clk_pin       | player/score_reg[4]/D     |
| sys_clk_pin        | sys_clk_pin       | dealer/score_reg[1]/D     |
| sys_clk_pin        | sys_clk_pin       | dealer/ace_count_reg[0]/D |
| sys_clk_pin        | sys_clk_pin       | player/score_reg[2]/D     |
+--------------------+-------------------+---------------------------+

File with complete list of pins: tight_setup_hold_pins.txt


Phase 5 Rip-up And Reroute

Phase 5.1 Global Iteration 0
 Number of Nodes with overlaps = 179
 Number of Nodes with overlaps = 114
 Number of Nodes with overlaps = 80
 Number of Nodes with overlaps = 37
 Number of Nodes with overlaps = 20
 Number of Nodes with overlaps = 9
 Number of Nodes with overlaps = 9
 Number of Nodes with overlaps = 7
 Number of Nodes with overlaps = 3
 Number of Nodes with overlaps = 2
 Number of Nodes with overlaps = 1
 Number of Nodes with overlaps = 5
 Number of Nodes with overlaps = 0
INFO: [Route 35-416] Intermediate Timing Summary | WNS=-1.927 | TNS=-21.289| WHS=N/A    | THS=N/A    |

Phase 5.1 Global Iteration 0 | Checksum: 2dd7cf458

Time (s): cpu = 00:00:05 ; elapsed = 00:00:22 . Memory (MB): peak = 1937.305 ; gain = 191.691

Phase 5.2 Global Iteration 1
 Number of Nodes with overlaps = 101
 Number of Nodes with overlaps = 27
 Number of Nodes with overlaps = 12
 Number of Nodes with overlaps = 5
 Number of Nodes with overlaps = 5
 Number of Nodes with overlaps = 2
 Number of Nodes with overlaps = 2
 Number of Nodes with overlaps = 0
INFO: [Route 35-416] Intermediate Timing Summary | WNS=-1.787 | TNS=-20.771| WHS=N/A    | THS=N/A    |

Phase 5.2 Global Iteration 1 | Checksum: 236706b29

Time (s): cpu = 00:00:05 ; elapsed = 00:00:22 . Memory (MB): peak = 1937.305 ; gain = 191.691

Phase 5.3 Global Iteration 2
 Number of Nodes with overlaps = 98
 Number of Nodes with overlaps = 55
 Number of Nodes with overlaps = 8
 Number of Nodes with overlaps = 12
 Number of Nodes with overlaps = 9
 Number of Nodes with overlaps = 3
 Number of Nodes with overlaps = 2
 Number of Nodes with overlaps = 2
 Number of Nodes with overlaps = 2
 Number of Nodes with overlaps = 1
 Number of Nodes with overlaps = 0
INFO: [Route 35-416] Intermediate Timing Summary | WNS=-1.899 | TNS=-21.969| WHS=N/A    | THS=N/A    |

Phase 5.3 Global Iteration 2 | Checksum: 1bf6971ed

Time (s): cpu = 00:00:05 ; elapsed = 00:00:23 . Memory (MB): peak = 1937.305 ; gain = 191.691
Phase 5 Rip-up And Reroute | Checksum: 1bf6971ed

Time (s): cpu = 00:00:05 ; elapsed = 00:00:23 . Memory (MB): peak = 1937.305 ; gain = 191.691

Phase 6 Delay and Skew Optimization

Phase 6.1 Delay CleanUp

Phase 6.1.1 Update Timing
Phase 6.1.1 Update Timing | Checksum: 22b0a69b6

Time (s): cpu = 00:00:05 ; elapsed = 00:00:23 . Memory (MB): peak = 1937.305 ; gain = 191.691
INFO: [Route 35-416] Intermediate Timing Summary | WNS=-1.691 | TNS=-19.467| WHS=N/A    | THS=N/A    |

 Number of Nodes with overlaps = 0
Phase 6.1 Delay CleanUp | Checksum: 23d7c781a

Time (s): cpu = 00:00:05 ; elapsed = 00:00:23 . Memory (MB): peak = 1937.305 ; gain = 191.691

Phase 6.2 Clock Skew Optimization
Phase 6.2 Clock Skew Optimization | Checksum: 23d7c781a

Time (s): cpu = 00:00:05 ; elapsed = 00:00:23 . Memory (MB): peak = 1937.305 ; gain = 191.691
Phase 6 Delay and Skew Optimization | Checksum: 23d7c781a

Time (s): cpu = 00:00:05 ; elapsed = 00:00:23 . Memory (MB): peak = 1937.305 ; gain = 191.691

Phase 7 Post Hold Fix

Phase 7.1 Hold Fix Iter
INFO: [Route 35-416] Intermediate Timing Summary | WNS=-1.679 | TNS=-19.494| WHS=0.155  | THS=0.000  |

Phase 7.1 Hold Fix Iter | Checksum: 29840d3ce

Time (s): cpu = 00:00:05 ; elapsed = 00:00:23 . Memory (MB): peak = 1937.305 ; gain = 191.691
Phase 7 Post Hold Fix | Checksum: 29840d3ce

Time (s): cpu = 00:00:05 ; elapsed = 00:00:23 . Memory (MB): peak = 1937.305 ; gain = 191.691

Phase 8 Route finalize

Router Utilization Summary
  Global Vertical Routing Utilization    = 0.100231 %
  Global Horizontal Routing Utilization  = 0.0905797 %
  Routable Net Status*
  *Does not include unroutable nets such as driverless and loadless.
  Run report_route_status for detailed report.
  Number of Failed Nets               = 0
    (Failed Nets is the sum of unrouted and partially routed nets)
  Number of Unrouted Nets             = 0
  Number of Partially Routed Nets     = 0
  Number of Node Overlaps             = 0


--GLOBAL Congestion:
Utilization threshold used for congestion level computation: 0.85
Congestion Report
North Dir 1x1 Area, Max Cong = 27.9279%, No Congested Regions.
South Dir 1x1 Area, Max Cong = 28.8288%, No Congested Regions.
East Dir 1x1 Area, Max Cong = 27.9412%, No Congested Regions.
West Dir 1x1 Area, Max Cong = 30.8824%, No Congested Regions.

------------------------------
Reporting congestion hotspots
------------------------------
Direction: North
----------------
Congested clusters found at Level 0
Effective congestion level: 0 Aspect Ratio: 1 Sparse Ratio: 0
Direction: South
----------------
Congested clusters found at Level 0
Effective congestion level: 0 Aspect Ratio: 1 Sparse Ratio: 0
Direction: East
----------------
Congested clusters found at Level 0
Effective congestion level: 0 Aspect Ratio: 1 Sparse Ratio: 0
Direction: West
----------------
Congested clusters found at Level 0
Effective congestion level: 0 Aspect Ratio: 1 Sparse Ratio: 0

Phase 8 Route finalize | Checksum: 29840d3ce

Time (s): cpu = 00:00:05 ; elapsed = 00:00:23 . Memory (MB): peak = 1937.305 ; gain = 191.691

Phase 9 Verifying routed nets

 Verification completed successfully
Phase 9 Verifying routed nets | Checksum: 29840d3ce

Time (s): cpu = 00:00:05 ; elapsed = 00:00:23 . Memory (MB): peak = 1937.305 ; gain = 191.691

Phase 10 Depositing Routes
Phase 10 Depositing Routes | Checksum: 25d181239

Time (s): cpu = 00:00:05 ; elapsed = 00:00:23 . Memory (MB): peak = 1937.305 ; gain = 191.691

Phase 11 Post Process Routing
Phase 11 Post Process Routing | Checksum: 25d181239

Time (s): cpu = 00:00:05 ; elapsed = 00:00:23 . Memory (MB): peak = 1937.305 ; gain = 191.691

Phase 12 Post Router Timing
INFO: [Route 35-57] Estimated Timing Summary | WNS=-1.679 | TNS=-19.494| WHS=0.155  | THS=0.000  |

WARNING: [Route 35-328] Router estimated timing not met.
Resolution: For a complete and accurate timing signoff, report_timing_summary must be run after route_design. Alternatively, route_design can be run with the -timing_summary option to enable a complete timing signoff at the end of route_design.
Phase 12 Post Router Timing | Checksum: 25d181239

Time (s): cpu = 00:00:05 ; elapsed = 00:00:23 . Memory (MB): peak = 1937.305 ; gain = 191.691
Total Elapsed time in route_design: 23.002 secs

Phase 13 Post-Route Event Processing
Phase 13 Post-Route Event Processing | Checksum: 1763acec7

Time (s): cpu = 00:00:05 ; elapsed = 00:00:23 . Memory (MB): peak = 1937.305 ; gain = 191.691
INFO: [Route 35-16] Router Completed Successfully
Ending Routing Task | Checksum: 1763acec7

Time (s): cpu = 00:00:05 ; elapsed = 00:00:23 . Memory (MB): peak = 1937.305 ; gain = 191.691

Routing Is Done.
INFO: [Common 17-83] Releasing license: Implementation
264 Infos, 1 Warnings, 0 Critical Warnings and 0 Errors encountered.
route_design completed successfully
route_design: Time (s): cpu = 00:00:05 ; elapsed = 00:00:23 . Memory (MB): peak = 1937.305 ; gain = 200.684
INFO: [Vivado 12-24828] Executing command : report_drc -file top_drc_routed.rpt -pb top_drc_routed.pb -rpx top_drc_routed.rpx
Command: report_drc -file top_drc_routed.rpt -pb top_drc_routed.pb -rpx top_drc_routed.rpx
INFO: [IP_Flow 19-1839] IP Catalog is up to date.
INFO: [DRC 23-27] Running DRC with 2 threads
INFO: [Vivado_Tcl 2-168] The results of DRC are in file C:/Users/Allen/Vivado Projects/FPGA-Blackjack/FPGA_Blackjack.runs/impl_1/top_drc_routed.rpt.
report_drc completed successfully
INFO: [Vivado 12-24828] Executing command : report_methodology -file top_methodology_drc_routed.rpt -pb top_methodology_drc_routed.pb -rpx top_methodology_drc_routed.rpx
Command: report_methodology -file top_methodology_drc_routed.rpt -pb top_methodology_drc_routed.pb -rpx top_methodology_drc_routed.rpx
INFO: [Timing 38-35] Done setting XDC timing constraints.
INFO: [DRC 23-133] Running Methodology with 2 threads
INFO: [Vivado_Tcl 2-1520] The results of Report Methodology are in file C:/Users/Allen/Vivado Projects/FPGA-Blackjack/FPGA_Blackjack.runs/impl_1/top_methodology_drc_routed.rpt.
report_methodology completed successfully
INFO: [Vivado 12-24828] Executing command : report_timing_summary -max_paths 10 -report_unconstrained -file top_timing_summary_routed.rpt -pb top_timing_summary_routed.pb -rpx top_timing_summary_routed.rpx -warn_on_violation 
INFO: [Timing 38-35] Done setting XDC timing constraints.
INFO: [Timing 38-91] UpdateTimingParams: Speed grade: -1, Delay Type: min_max.
INFO: [Timing 38-191] Multithreading enabled for timing update using a maximum of 2 CPUs
CRITICAL WARNING: [Timing 38-282] The design failed to meet the timing requirements. Please see the timing summary report for details on the timing violations.
INFO: [Vivado 12-24838] Running report commands "report_incremental_reuse, report_route_status" in parallel.
Running report generation with 2 threads.
INFO: [Vivado 12-24828] Executing command : report_route_status -file top_route_status.rpt -pb top_route_status.pb
INFO: [Vivado 12-24828] Executing command : report_incremental_reuse -file top_incremental_reuse_routed.rpt
INFO: [Vivado_Tcl 4-1062] Incremental flow is disabled. No incremental reuse Info to report.
INFO: [Vivado 12-24828] Executing command : report_power -file top_power_routed.rpt -pb top_power_summary_routed.pb -rpx top_power_routed.rpx
Command: report_power -file top_power_routed.rpt -pb top_power_summary_routed.pb -rpx top_power_routed.rpx
Running Vector-less Activity Propagation...

Finished Running Vector-less Activity Propagation
281 Infos, 1 Warnings, 1 Critical Warnings and 0 Errors encountered.
report_power completed successfully
INFO: [Vivado 12-24828] Executing command : report_clock_utilization -file top_clock_utilization_routed.rpt
INFO: [Vivado 12-24828] Executing command : report_bus_skew -warn_on_violation -file top_bus_skew_routed.rpt -pb top_bus_skew_routed.pb -rpx top_bus_skew_routed.rpx
INFO: [Timing 38-91] UpdateTimingParams: Speed grade: -1, Delay Type: min_max.
INFO: [Timing 38-191] Multithreading enabled for timing update using a maximum of 2 CPUs
INFO: [Timing 38-480] Writing timing data to binary archive.
Write ShapeDB Complete: Time (s): cpu = 00:00:00 ; elapsed = 00:00:00.001 . Memory (MB): peak = 1966.180 ; gain = 0.000
Wrote PlaceDB: Time (s): cpu = 00:00:00 ; elapsed = 00:00:00.024 . Memory (MB): peak = 1966.180 ; gain = 0.000
Wrote PulsedLatchDB: Time (s): cpu = 00:00:00 ; elapsed = 00:00:00 . Memory (MB): peak = 1966.180 ; gain = 0.000
Writing XDEF routing.
Writing XDEF routing logical nets.
Writing XDEF routing special nets.
Wrote RouteStorage: Time (s): cpu = 00:00:00 ; elapsed = 00:00:00.014 . Memory (MB): peak = 1966.180 ; gain = 0.000
Wrote Netlist Cache: Time (s): cpu = 00:00:00 ; elapsed = 00:00:00 . Memory (MB): peak = 1966.180 ; gain = 0.000
Wrote Device Cache: Time (s): cpu = 00:00:00 ; elapsed = 00:00:00.004 . Memory (MB): peak = 1966.180 ; gain = 0.000
Write Physdb Complete: Time (s): cpu = 00:00:00 ; elapsed = 00:00:00.046 . Memory (MB): peak = 1966.180 ; gain = 0.000
INFO: [Common 17-1381] The checkpoint 'C:/Users/Allen/Vivado Projects/FPGA-Blackjack/FPGA_Blackjack.runs/impl_1/top_routed.dcp' has been generated.
Command: write_bitstream -force top.bit
Attempting to get a license for feature 'Implementation' and/or device 'xc7a100t'
INFO: [Common 17-349] Got license for feature 'Implementation' and/or device 'xc7a100t'
Running DRC as a precondition to command write_bitstream
INFO: [IP_Flow 19-1839] IP Catalog is up to date.
INFO: [DRC 23-27] Running DRC with 2 threads
INFO: [Vivado 12-3199] DRC finished with 0 Errors
INFO: [Vivado 12-3200] Please refer to the DRC report (report_drc) for more information.
INFO: [Designutils 20-2272] Running write_bitstream with 2 threads.
Loading data files...
Loading site data...
Loading route data...
Processing options...
Creating bitmap...
Creating bitstream...
Writing bitstream ./top.bit...
INFO: [Vivado 12-1842] Bitgen Completed Successfully.
INFO: [Project 1-1876] WebTalk data collection is mandatory when using a ULT device. To see the specific WebTalk data collected for your design, open the usage_statistics_webtalk.html or usage_statistics_webtalk.xml file in the implementation directory.
INFO: [Common 17-83] Releasing license: Implementation
296 Infos, 1 Warnings, 1 Critical Warnings and 0 Errors encountered.
write_bitstream completed successfully
write_bitstream: Time (s): cpu = 00:00:02 ; elapsed = 00:00:07 . Memory (MB): peak = 2466.246 ; gain = 500.066
INFO: [Common 17-206] Exiting Vivado at Sat Dec  6 19:20:11 2025...

*** Running vivado
    with args -log top.vdi -applog -m64 -product Vivado -messageDb vivado.pb -mode batch -source top.tcl -notrace



****** Vivado v2024.2 (64-bit)
  **** SW Build 5239630 on Fri Nov 08 22:35:27 MST 2024
  **** IP Build 5239520 on Sun Nov 10 16:12:51 MST 2024
  **** SharedData Build 5239561 on Fri Nov 08 14:39:27 MST 2024
  **** Start of session at: Sat Dec  6 19:32:54 2025
    ** Copyright 1986-2022 Xilinx, Inc. All Rights Reserved.
    ** Copyright 2022-2024 Advanced Micro Devices, Inc. All Rights Reserved.

Sourcing tcl script 'C:/Users/Allen/AppData/Roaming/Xilinx/Vivado/Vivado_init.tcl'
source top.tcl -notrace
Command: open_checkpoint top_routed.dcp
INFO: [Device 21-403] Loading part xc7a100tcsg324-1
Netlist sorting complete. Time (s): cpu = 00:00:00 ; elapsed = 00:00:00.003 . Memory (MB): peak = 562.746 ; gain = 0.000
INFO: [Netlist 29-17] Analyzing 22 Unisim elements for replacement
INFO: [Netlist 29-28] Unisim Transformation completed in 0 CPU seconds
INFO: [Project 1-479] Netlist was created with Vivado 2024.2
INFO: [Project 1-570] Preparing netlist for logic optimization
Read ShapeDB Complete: Time (s): cpu = 00:00:00 ; elapsed = 00:00:00.002 . Memory (MB): peak = 652.840 ; gain = 0.074
INFO: [Timing 38-478] Restoring timing data from binary archive.
INFO: [Timing 38-479] Binary timing data restore complete.
INFO: [Project 1-856] Restoring constraints from binary archive.
INFO: [Project 1-853] Binary constraint restore complete.
INFO: [Designutils 20-5722] Start Reading Physical Databases.
Reading placement.
Read Netlist Cache: Time (s): cpu = 00:00:00 ; elapsed = 00:00:00 . Memory (MB): peak = 1271.031 ; gain = 0.000
Reading placer database...
Read Device Cache: Time (s): cpu = 00:00:00 ; elapsed = 00:00:00.006 . Memory (MB): peak = 1271.031 ; gain = 0.000
Read PlaceDB: Time (s): cpu = 00:00:00 ; elapsed = 00:00:00.016 . Memory (MB): peak = 1271.031 ; gain = 0.000
Read PulsedLatchDB: Time (s): cpu = 00:00:00 ; elapsed = 00:00:00 . Memory (MB): peak = 1271.031 ; gain = 0.000
Reading routing.
Read RouteStorage: Time (s): cpu = 00:00:00 ; elapsed = 00:00:00.007 . Memory (MB): peak = 1271.031 ; gain = 0.000
Read Physdb Files: Time (s): cpu = 00:00:00 ; elapsed = 00:00:00.035 . Memory (MB): peak = 1271.031 ; gain = 0.000
Restored from archive | CPU: 0.000000 secs | Memory: 0.000000 MB |
Finished XDEF File Restore: Time (s): cpu = 00:00:00 ; elapsed = 00:00:00.072 . Memory (MB): peak = 1271.031 ; gain = 7.570
Netlist sorting complete. Time (s): cpu = 00:00:00 ; elapsed = 00:00:00 . Memory (MB): peak = 1271.031 ; gain = 0.000
INFO: [Project 1-111] Unisim Transformation Summary:
No Unisim elements were transformed.

INFO: [Project 1-604] Checkpoint was created with Vivado v2024.2 (64-bit) build 5239630
open_checkpoint: Time (s): cpu = 00:00:01 ; elapsed = 00:00:10 . Memory (MB): peak = 1271.031 ; gain = 987.715
Command: write_bitstream -force top.bit
Attempting to get a license for feature 'Implementation' and/or device 'xc7a100t'
INFO: [Common 17-349] Got license for feature 'Implementation' and/or device 'xc7a100t'
Running DRC as a precondition to command write_bitstream
INFO: [IP_Flow 19-234] Refreshing IP repositories
INFO: [IP_Flow 19-1704] No user IP repositories specified
INFO: [IP_Flow 19-2313] Loaded Vivado IP repository 'C:/Xilinx/Vivado/2024.2/data/ip'.
INFO: [DRC 23-27] Running DRC with 2 threads
INFO: [Vivado 12-3199] DRC finished with 0 Errors
INFO: [Vivado 12-3200] Please refer to the DRC report (report_drc) for more information.
INFO: [Designutils 20-2272] Running write_bitstream with 2 threads.
Loading data files...
Loading site data...
Loading route data...
Processing options...
Creating bitmap...
Creating bitstream...
Writing bitstream ./top.bit...
INFO: [Vivado 12-1842] Bitgen Completed Successfully.
INFO: [Project 1-1876] WebTalk data collection is mandatory when using a ULT device. To see the specific WebTalk data collected for your design, open the usage_statistics_webtalk.html or usage_statistics_webtalk.xml file in the implementation directory.
INFO: [Common 17-83] Releasing license: Implementation
23 Infos, 0 Warnings, 0 Critical Warnings and 0 Errors encountered.
write_bitstream completed successfully
write_bitstream: Time (s): cpu = 00:00:03 ; elapsed = 00:00:08 . Memory (MB): peak = 1853.707 ; gain = 582.676
INFO: [Common 17-206] Exiting Vivado at Sat Dec  6 19:33:13 2025...
